<?xml version="1.0" encoding="UTF-8"?>
<!DOCTYPE MancalaGame SYSTEM "../MancalaGame.dtd">
<MancalaGame>
    <Player>
        <Name>abc</Name>
        <WinCount>1</WinCount>
        <PlayersHalf>
            <Kalah>
                <SeedCount>10</SeedCount>
            </Kalah>
            <House>
                <SeedCount>2</SeedCount>
            </House>
            <House>
                <SeedCount>3</SeedCount>
            </House>
            <House>
                <SeedCount>4</SeedCount>
            </House>
            <House>
                <SeedCount>1</SeedCount>
            </House>
            <House>
                <SeedCount>6</SeedCount>
            </House>
            <House>
                <SeedCount>10</SeedCount>
            </House>
        </PlayersHalf>
        <SeedCount>36</SeedCount>
    </Player>
    <Player>
        <Name>xyz</Name>
        <WinCount>2</WinCount>
        <PlayersHalf>
            <Kalah>
                <SeedCount>8</SeedCount>
            </Kalah>
            <House>
                <SeedCount>8</SeedCount>
            </House>
            <House>
                <SeedCount>10</SeedCount>
            </House>
            <House>
                <SeedCount>4</SeedCount>
            </House>
            <House>
                <SeedCount>1</SeedCount>
            </House>
            <House>
                <SeedCount>3</SeedCount>
            </House>
            <House>
                <SeedCount>2</SeedCount>
            </House>
        </PlayersHalf>
        <SeedCount>36</SeedCount>
    </Player>
    <PlayerOnTurn>abc</PlayerOnTurn>
</MancalaGame>