<?xml version="1.0" encoding="UTF-8"?>
<!DOCTYPE MancalaGame SYSTEM "../MancalaGame.dtd">
<MancalaGame>
    <Player>
        <Name>Player1</Name>
        <WinCount>5</WinCount>
        <PlayersHalf>
            <Kalah>
                <SeedCount>10</SeedCount>
            </Kalah>
            <House>
                <SeedCount>3</SeedCount>
            </House>
            <House>
                <SeedCount>3</SeedCount>
            </House>
            <House>
                <SeedCount>4</SeedCount>
            </House>
            <House>
                <SeedCount>1</SeedCount>
            </House>
            <House>
                <SeedCount>6</SeedCount>
            </House>
            <House>
                <SeedCount>3</SeedCount>
            </House>
        </PlayersHalf>
        <SeedCount>6</SeedCount>
    </Player>
    <Player>
        <Name>Player2</Name>
        <WinCount>13</WinCount>
        <PlayersHalf>
            <Kalah>
                <SeedCount>8</SeedCount>
            </Kalah>
            <House>
                <SeedCount>8</SeedCount>
            </House>
            <House>
                <SeedCount>10</SeedCount>
            </House>
            <House>
                <SeedCount>4</SeedCount>
            </House>
            <House>
                <SeedCount>1</SeedCount>
            </House>
            <House>
                <SeedCount>2</SeedCount>
            </House>
            <House>
                <SeedCount>1</SeedCount>
            </House>
        </PlayersHalf>
        <SeedCount>2</SeedCount>
    </Player>
    <PlayerOnTurn>Player1</PlayerOnTurn>
</MancalaGame>